{
  "$schema": "https://json-schema.org/draft/2020-12/schema",
  "$id": "https://hossambahr.com/schemas/service-review-dossier.schema.json",
  "title": "Progressive Service Review Dossier",
  "type": "object",
  "additionalProperties": false,
  "required": ["legacyId", "candidateId", "targetServiceId", "authorityId", "status", "reviewedData", "checks", "finalDecision"],
  "properties": {
    "legacyId": { "type": "string", "minLength": 1 },
    "candidateId": { "type": "string", "minLength": 1 },
    "targetServiceId": { "type": "string", "pattern": "^[a-z0-9]+(?:-[a-z0-9]+)*$" },
    "authorityId": { "type": "string", "minLength": 1 },
    "status": { "type": "string", "enum": ["pending", "in-review", "approved", "rejected"] },
    "reviewedData": {
      "type": "object",
      "additionalProperties": false,
      "properties": {
        "name": { "type": "object" },
        "description": { "type": "object" },
        "audiences": { "type": "array" },
        "requestType": { "type": "object" },
        "authorityId": { "type": "string" },
        "emirateId": { "type": "string" },
        "category": { "type": "object" },
        "customerTypeIds": { "type": "array" },
        "activityIds": { "type": "array" },
        "licenseTypeIds": { "type": "array" },
        "classificationNumbers": { "type": "array" },
        "keywords": { "type": "object" },
        "content": { "type": "object" },
        "faq": { "type": "array" },
        "documents": { "type": "object" },
        "governmentFees": { "type": "object" },
        "serviceFees": { "type": "object" },
        "duration": { "type": "object" },
        "relatedServiceIds": { "type": "array" },
        "alternativeServiceIds": { "type": "array" },
        "officialGovernmentLink": { "type": "object" }
      }
    },
    "checks": {
      "type": "array",
      "minItems": 21,
      "maxItems": 21,
      "items": { "$ref": "#/$defs/check" }
    },
    "finalDecision": {
      "type": "object",
      "additionalProperties": false,
      "required": ["approvedAt", "approvedBy", "notes", "evidence"],
      "properties": {
        "approvedAt": { "type": ["string", "null"], "format": "date-time" },
        "approvedBy": { "type": ["string", "null"] },
        "notes": { "type": "string" },
        "evidence": { "type": "array", "items": { "$ref": "#/$defs/evidence" } }
      }
    }
  },
  "$defs": {
    "check": {
      "type": "object",
      "additionalProperties": false,
      "required": ["order", "id", "status", "reviewedAt", "notes", "evidence"],
      "properties": {
        "order": { "type": "integer", "minimum": 1, "maximum": 21 },
        "id": { "type": "string", "minLength": 1 },
        "status": { "type": "string", "enum": ["pending", "passed", "failed"] },
        "reviewedAt": { "type": ["string", "null"], "format": "date-time" },
        "notes": { "type": "string" },
        "evidence": { "type": "array", "items": { "$ref": "#/$defs/evidence" } }
      }
    },
    "evidence": {
      "type": "object",
      "additionalProperties": false,
      "required": ["type", "value", "capturedAt"],
      "properties": {
        "type": { "type": "string", "enum": ["official-source", "screenshot", "http-log", "manual-log", "search-log", "journey-log"] },
        "value": { "type": "string", "minLength": 1 },
        "capturedAt": { "type": "string", "format": "date-time" }
      }
    }
  }
}
